<?xml version="1.0" encoding="ISO-8859-1" ?>

<!--
  $Revision: 1.1 $
  $Date: 2010/10/27 14:32:18 $
  $Author: willuhn $
 
  Copyright (c) by willuhn software & services
  All rights reserved

  This program is free software; you can redistribute it and/or modify
  it under the terms of the GNU General Public License as published by
  the Free Software Foundation; either version 2 of the License, or
  (at your option) any later version.
  
  This program is distributed in the hope that it will be useful,
  but WITHOUT ANY WARRANTY; without even the implied warranty of
  MERCHANTABILITY or FITNESS FOR A PARTICULAR PURPOSE.  See the
  GNU General Public License for more details.

  You should have received a copy of the GNU General Public License
  along with this program; if not, write to the Free Software
  Foundation, Inc., 675 Mass Ave, Cambridge, MA 02139, USA.

-->

<xsd:schema xml:lang="DE" elementFormDefault="qualified"
  xmlns:xsd="http://www.w3.org/2001/XMLSchema"
  targetNamespace="http://www.willuhn.de/schema/jameica-webtools"
  xmlns:tns="http://www.willuhn.de/schema/jameica-webtools">

  <xsd:annotation>
     <xsd:documentation>
       XML-Spezifikation des XML-Formats fuer die "webtools.xml" von Webanwendungen, die
       das jameica.webtools Framework nutzen.
     </xsd:documentation>
  </xsd:annotation>

  <!-- Root-Element //-->
  <xsd:element name="webtools" type="tns:webtoolsType" />

  <!-- Element "webtools" //-->
  <xsd:complexType name="webtoolsType">
    <xsd:annotation>
      <xsd:documentation>Root-Element einer webtools.xml</xsd:documentation>
    </xsd:annotation>
    <xsd:choice>
      <xsd:element name="beans" type="tns:beansType" minOccurs="0" maxOccurs="1" />
      <xsd:element name="pages" type="tns:pagesType" minOccurs="1" maxOccurs="1" />
    </xsd:choice>
  </xsd:complexType>


  <!-- Element "pages" //-->
  <xsd:complexType name="pagesType">
    <xsd:annotation>
      <xsd:documentation>Container-Element fuer die einzelnen Seiten</xsd:documentation>
    </xsd:annotation>
    <xsd:sequence>
      <xsd:annotation>
        <xsd:documentation>Enthält die Liste der definierten Pages</xsd:documentation>
      </xsd:annotation>
      <xsd:element name="page" type="tns:pageType" minOccurs="1" maxOccurs="unbounded" />
    </xsd:sequence>
  </xsd:complexType>


  <!-- Element "page" //-->
  <xsd:complexType name="pageType">
    <xsd:annotation>
      <xsd:documentation>Definition einer einzelnen Page.</xsd:documentation>
    </xsd:annotation>
    <xsd:attribute name="pattern" type="xsd:string" use="required">
      <xsd:annotation>
        <xsd:documentation>
          Regulärer Ausdruck, auf den der aktuelle PathInfo passen muss, 
          damit diese Page ausgewählt wird.
        </xsd:documentation>
      </xsd:annotation>
    </xsd:attribute>
    <xsd:attribute name="template" type="xsd:string" use="required">
      <xsd:annotation>
        <xsd:documentation>
          Dateiname des zu verwendenden Velocity-Templates. Die Template-Datei
          muss sich im Verzeichnis lib/velocity des Plugins befinden.
        </xsd:documentation>
      </xsd:annotation>
    </xsd:attribute>
    <xsd:attribute name="action" type="xsd:string" use="optional">
      <xsd:annotation>
        <xsd:documentation>
          Optionale Default-Action, die ausgefuehrt wird, wenn im HTTP-Request
          keine angegeben ist.
        </xsd:documentation>
      </xsd:annotation>
    </xsd:attribute>
    <xsd:attribute name="controller" type="xsd:string" use="optional">
      <xsd:annotation>
        <xsd:documentation>
          Name der Java-Klasse des zugehoerigen Controllers, falls einer
          verwendet werden soll. Ein Controller ist eine ganz normale
          Bean mit parameterlosem Konstruktor.
        </xsd:documentation>
      </xsd:annotation>
    </xsd:attribute>
  </xsd:complexType>

  <!-- Element "beans" //-->
  <xsd:complexType name="beansType">
    <xsd:annotation>
      <xsd:documentation>Container-Element fuer allgemeine Beans</xsd:documentation>
    </xsd:annotation>
    <xsd:sequence>
      <xsd:annotation>
        <xsd:documentation>Enthält die Liste der definierten Beans</xsd:documentation>
      </xsd:annotation>
      <xsd:element name="bean" type="tns:beanType" minOccurs="0" maxOccurs="unbounded" />
    </xsd:sequence>
  </xsd:complexType>

  <!-- Element "bean" //-->
  <xsd:complexType name="beanType">
    <xsd:annotation>
      <xsd:documentation>Definition einer einzelnen Bean.</xsd:documentation>
    </xsd:annotation>
    <xsd:attribute name="name" type="xsd:string" use="required">
      <xsd:annotation>
        <xsd:documentation>
          Alias-Name, unter der die Bean verfuegbar sein soll.
        </xsd:documentation>
      </xsd:annotation>
    </xsd:attribute>
    <xsd:attribute name="class" type="xsd:string" use="required">
      <xsd:annotation>
        <xsd:documentation>
          Name der Java-Klasse der Bean.
        </xsd:documentation>
      </xsd:annotation>
    </xsd:attribute>
  </xsd:complexType>

</xsd:schema>
