<?xml version="1.0" encoding="ISO-8859-1"?>

<webtools xmlns:wt="http://www.willuhn.de/schema/jameica-webtools"
          xmlns:xsi="http://www.w3.org/2001/XMLSchema-instance"
          xsi:schemaLocation="http://www.willuhn.de/schema/jameica-webtools http://www.willuhn.de/schema/jameica-webtools-1.0.xsd ">

  <!-- Global verfuegbare Beans -->
  <beans>
    <bean name="application" class="de.willuhn.jameica.webadmin.rest.Application" />
    <bean name="certificate" class="de.willuhn.jameica.webadmin.rest.Certificate" />
    <bean name="log"         class="de.willuhn.jameica.webadmin.rest.Log" />
    <bean name="plugin"      class="de.willuhn.jameica.webadmin.rest.Plugin" />
    <bean name="server"      class="de.willuhn.jameica.webadmin.rest.Server" />
    <bean name="service"     class="de.willuhn.jameica.webadmin.rest.Service" />
    <bean name="restdoc"     class="de.willuhn.jameica.webadmin.rest.RestDoc" />
  </beans>

  <!-- Die konkreten Pages -->
  <pages>
    <page pattern="^/rest.html"   template="rest.vm" />
    <page pattern="^/cert.html"   template="cert.vm"   controller="de.willuhn.jameica.webadmin.rest.Certificate" action="upload" />
    <page pattern="^/plugin.html" template="plugin.vm" controller="de.willuhn.jameica.webadmin.rest.Plugin" />
    
    <!-- Default-Seite -->
    <page pattern=".*"            template="index.vm" />
  </pages>
  
  
</webtools>
